{
  "schemaVersion": 1,
  "runId": "2026-09-22-cp3-evaluator-integrity",
  "recordedAt": "2026-09-23T03:51:53Z",
  "owner": "Travis",
  "stage": "T",
  "status": "completed",
  "scope": "M1 CP3 evaluator integrity",
  "modelInferencePerformed": false,
  "paidGpuStarted": false,
  "weightsModified": false,
  "modelSelectionStatus": "benchmark_required",
  "modelRevision": null,
  "runtimeVersion": null,
  "gpu": null,
  "configurationFingerprint": "aa5a7e9a20513d4dcc229222780ef971be2d0fa064b2570f862cfb91e259f99a",
  "lastDurableHandoff": "CP3 evaluator integrity verified locally; see decision.md and test evidence.",
  "nextAction": "Combine CP2, CP3, and CP4 evidence before any fresh paid-run authorization."
}
