{
  "schemaVersion": 1,
  "runId": "2026-09-23T074640Z-start-veronica",
  "recordedAt": "2026-09-23T07:46:50Z",
  "owner": "Travis",
  "stage": "D",
  "status": "in_progress",
  "scope": "M2 CP5 diagnostic live qualification",
  "modelInferencePerformed": false,
  "paidGpuStarted": false,
  "weightsModified": false,
  "modelSelectionStatus": "benchmark_required",
  "modelRevision": null,
  "runtimeVersion": null,
  "gpu": null,
  "configurationFingerprint": "aa5a7e9a20513d4dcc229222780ef971be2d0fa064b2570f862cfb91e259f99a",
  "lastDurableHandoff": "Run folder initialized; evidence pending.",
  "nextAction": "Record decision.md and required evidence. Do not overwrite this folder."
}
