{
  "schemaVersion": 1,
  "runId": "2026-09-23-t2-readiness-review",
  "recordedAt": "2026-09-23T07:37:48Z",
  "owner": "Travis",
  "stage": "T2",
  "status": "in_progress",
  "scope": "Combined CP2 CP3 CP4 readiness review",
  "modelInferencePerformed": false,
  "paidGpuStarted": false,
  "weightsModified": false,
  "modelSelectionStatus": "benchmark_required",
  "modelRevision": null,
  "runtimeVersion": null,
  "gpu": null,
  "configurationFingerprint": "aa5a7e9a20513d4dcc229222780ef971be2d0fa064b2570f862cfb91e259f99a",
  "lastDurableHandoff": "Run folder initialized; evidence pending.",
  "nextAction": "Record decision.md and required evidence. Do not overwrite this folder."
}
