{
  "schemaVersion": 1,
  "runId": "2026-09-22-core-status-plan",
  "recordedAt": "2026-09-23T03:39:37Z",
  "owner": "Travis",
  "stage": "E",
  "status": "in_progress",
  "scope": "Core status and execution plan",
  "modelInferencePerformed": false,
  "paidGpuStarted": false,
  "weightsModified": false,
  "modelSelectionStatus": "benchmark_required",
  "modelRevision": null,
  "runtimeVersion": null,
  "gpu": null,
  "configurationFingerprint": "aa5a7e9a20513d4dcc229222780ef971be2d0fa064b2570f862cfb91e259f99a",
  "lastDurableHandoff": "Run folder initialized; evidence pending.",
  "nextAction": "Record decision.md and required evidence. Do not overwrite this folder."
}
